Date;Date de valeur;Débit;Crédit;Libellé;Solde
01/12/2022;01/12/2022;-3000,00;;VIR SEPA COMPTE COMMUN - MIKA M;608,77
02/12/2022;02/12/2022;-73,13;;PRLV SEPA PAYPAL EUROPE S A R L 1023820767969 1023820767969 PAYPAL;535,64
05/12/2022;05/12/2022;-189,80;;PRLV SEPA PAYPAL EUROPE S A R L 1023831743752 1023831743752 PAYPAL;345,84
07/12/2022;07/12/2022;;16,00;VIR PAYPAL EUROPE S A R L  E YYW1023944870681 YYW1023944870681 PAYPAL;361,84
09/12/2022;01/12/2022;-12,00;;F COTIS CP GLOBAL;349,84
21/12/2022;21/12/2022;;3188,66;VIR SALAIRE ARKADE VIRT  APPOINTEMENTS;3538,50
21/12/2022;21/12/2022;-3000,00;;VIR SEPA COMPTE COMMUN - MIKA M;538,50
