Date;Date de valeur;Débit;Crédit;Libellé;Solde
01/02/2023;01/02/2023;-2000,00;;VIR SEPA COMPTE COMMUN - MIKA M;249,27
06/02/2023;06/02/2023;-1,70;;PAIEMENT PSC 0302 BREST RD BREST BIBUS CARTE 0140;247,57
07/02/2023;07/02/2023;-15,60;;PRLV SEPA PAYPAL EUROPE S A R L 1025082666082 1025082666082 PAYPAL;231,97
07/02/2023;01/02/2023;-12,00;;F COTIS CP GLOBAL;219,97
13/02/2023;13/02/2023;-13,61;;PRLV SEPA PAYPAL EUROPE S A R L 1025188319814 1025188319814 PAYPAL;206,36
13/02/2023;13/02/2023;-8,82;;PRLV SEPA PAYPAL EUROPE S A R L 1025189002308 1025189002308 PAYPAL;197,54
28/02/2023;28/02/2023;;2053,40;VIR SALAIRE ARKADE VIRT  APPOINTEMENTS;2250,94
28/02/2023;28/02/2023;-2000,00;;VIR INST COMPTE COMMUN - MIKA M VU305948CD0LPK01;250,94
