Date;Date de valeur;Débit;Crédit;Libellé;Solde
02/07/2023;02/07/2023;-3000,00;;VIR SEPA COMPTE COMMUN - MIKA M;283,89
04/07/2023;04/07/2023;-20,99;;PRLV SEPA PAYPAL EUROPE S A R L 1027955360334 1027955360334 PAYPAL;262,90
07/07/2023;01/07/2023;-12,24;;F COTIS CP GLOBAL;250,66
25/07/2023;25/07/2023;-3,33;;PRLV SEPA PAYPAL EUROPE S A R L 1028318144576 1028318144576 PAYPAL;247,33
31/07/2023;31/07/2023;;1979,53;VIR SALAIRE ARKADE VIRT  APPOINTEMENTS;2226,86
31/07/2023;31/07/2023;-2000,00;;VIR SEPA COMPTE COMMUN - MIKA M;226,86